Acknowledgment in paper for United States,Count,Percentage,Percentage in 2018,Difference with previous year
Not mentioned at all,24,18.045112781954884,21.73913043478261,-3.694017652827725
Acknowledged in the main text,6,4.511278195488721,12.318840579710146,-7.807562384221425
Acknowledged in acknowledgements section,29,21.804511278195488,16.666666666666664,5.137844611528823
Named as co-author,71,53.383458646616546,47.10144927536232,6.282009371254226
Named as main author,3,2.2556390977443606,2.1739130434782608,0.0817260542660998
