Reasons to choose current job,Rank 1,Rank 2,Rank 3,Rank 4,Rank 5
Desire to advance research,19.230769230769234,11.538461538461538,19.230769230769234,4.166666666666666,4.545454545454546
Desire to work in a research environment,15.384615384615385,19.230769230769234,19.230769230769234,4.166666666666666,
Flexible working hours,11.538461538461538,3.8461538461538463,11.538461538461538,4.166666666666666,31.818181818181817
Freedom to choose own working practices,11.538461538461538,26.923076923076923,11.538461538461538,12.5,18.181818181818183
I want to learn new skills,11.538461538461538,7.6923076923076925,11.538461538461538,20.833333333333336,22.727272727272727
Opportunity to develop software,11.538461538461538,19.230769230769234,7.6923076923076925,8.333333333333332,9.090909090909092
The salary,11.538461538461538,,7.6923076923076925,,4.545454545454546
Ability to work across disciplines,3.8461538461538463,,7.6923076923076925,33.33333333333333,9.090909090909092
Opportunity for career advancement,3.8461538461538463,11.538461538461538,3.8461538461538463,12.5,
